,description,number_rates,rating,price,url
139,"Kids Vitamins. Unflavored & Tasteless Liquid Kids Multivitamin. Sugar Free 14-in-1 Vegan Supplement Drops for Kids, Children, Teens. Mix in Juice, Milk, Or Water and Your Kids Won't Even Taste It!",6,3.5,15.95,https://www.amazon.com/gp/slredirect/picassoRedirect.html/ref=pa_sp_mtf_aps_sr_pg3_1?ie=UTF8&adId=A00712147ULTKR3WFA5D&url=%2FVitamins-Unflavored-Tasteless-Multivitamin-Supplement%2Fdp%2FB0B15PCP4W%2Fref%3Dsr_1_116_sspa%3Fkeywords%3Dmultivitamin%2Bfor%2Bkids%26qid%3D1660952888%26sr%3D8-116-spons%26psc%3D1&qualifier=1660952888&id=2908298790410877&widgetName=sp_mtf
140,Multivitamin for Kids USDA Organic | Sugar Free Kids Multivitamin | Liquid Vitamins for Kids | Immune Support Supplement | Cognitive Health & Overall Wellness | Vegan | 14 - 0.5 Fl Oz Pouches,2,5.0,14.95,https://www.amazon.com/Multivitamin-Vitamins-Supplement-Cognitive-Wellness/dp/B0B6WV8NQB/ref=sr_1_117?keywords=multivitamin+for+kids&qid=1660952888&sr=8-117
141,"Bluebonnet Nutrition Rainforest Animalz Whole Food Based Multiple Chewable Tablets, Kids Multivitamin & Mineral, Vitamin C, D3, Iron, Gluten Free, Milk Free, Kosher, 90 Chewable Tablets, Mixed Flavors",315,4.5,15.16,https://www.amazon.com/Bluebonnet-Nutrition-Rainforest-Multiple-Multivitamin/dp/B004WP2MFU/ref=sr_1_118?keywords=multivitamin+for+kids&qid=1660952888&sr=8-118
142,"NaturesPlus Animal Parade Source of Life Children's Liquid Multivitamin - Tropical Berry Flavor - 8 fl oz - Whole Food Supplement - Vegetarian, Gluten-Free - 16 Servings",147,4.0,9.95,https://www.amazon.com/Animal-Parade-Liquid-Tropical-Travel/dp/B000DN821S/ref=sr_1_119?keywords=multivitamin+for+kids&qid=1660952888&sr=8-119
143,"Go Healthy Multivitamin Gummies for Kids, Vegetarian, Allergy Friendly, Kosher & Halal - 30 Servings",454,4.4,15.99,https://www.amazon.com/Go-Healthy-Natural-Multivitamin-Vegetarian/dp/B07217Z28D/ref=sr_1_120?keywords=multivitamin+for+kids&qid=1660952888&sr=8-120
144,"Hero Nutritionals | Yummi Bears | Complete Multivitamin & Mineral | Gummy Vitamin for Kids | Dietary Supplement | 16 Essential Vitamins, Nutrients & Minerals | 200 Yummi Gummies",496,4.5,39.99,https://www.amazon.com/Yummi-Bears-Nutritionals-Multivitamin-Supplement/dp/B001AZNKYM/ref=sr_1_121?keywords=multivitamin+for+kids&qid=1660952888&sr=8-121
145,"Lifeable Kids Multivitamin – Great Tasting Natural Flavor Gummy – Vegetarian, GMO Free Vitamin Supplement – with Vitamins A, C, D, E, B6, B12, Zinc, Biotin, Folic Acid, Iodine, Niacin – 90 Gummies",155,4.5,12.99,https://www.amazon.com/VitaWorks-Kids-Multivitamin-Vegetarian-Supplement/dp/B08C75BHL6/ref=sr_1_122?keywords=multivitamin+for+kids&qid=1660952888&sr=8-122
146,"Children's Best Organic Kids Multivitamin Gummies with Biotin, Vitamin A, B6, B12, C, D, Folate, Zinc - 90 Fruit Flavored Gummies",70,4.6,25.10,https://www.amazon.com/Childrens-Best-Organic-Multivitamin-Gummies/dp/B0977PCT9B/ref=sr_1_123?keywords=multivitamin+for+kids&qid=1660952888&sr=8-123
147,"LIQUIDHEALTH 16 Oz Kids Liquid Multivitamin Complete Multiple for Children, Toddlers - Essential Vitamins & Minerals Supplement, Immune Support, Gluten Free, Non GMO, Prebiotic Fiber",68,4.3,26.99,https://www.amazon.com/LIQUIDHEALTH-Multivitamin-Complete-Multiple-Children/dp/B0033L8N8Y/ref=sr_1_124?keywords=multivitamin+for+kids&qid=1660952888&sr=8-124
148,"Codeage Daily Teen Multivitamin - Organic Whole Foods - Probiotic Fermented Vitamins - Enzymes, Minerals for Teenage Boys & Girls - Vegan, Non-GMO, Gluten Free Supplement for Active Kids - 2 Pack",696,4.5,49.99,https://www.amazon.com/Codeage-Daily-Teen-Multivitamin-Supplement/dp/B09Y2JZC73/ref=sr_1_125?keywords=multivitamin+for+kids&qid=1660952888&sr=8-125
149,"Kids Multivitamin Gummies with Zinc and Vitamins C, B12, D3, for Immune Support, Complete Daily Nutrient Rich Chewables for Children and Toddlers, Non-GMO, Tasty Strawberry Flavor, 60 Gummy Chews",44,4.5,9.82,https://www.amazon.com/Multivitamin-Vitamins-Complete-Chewables-Strawberry/dp/B0998MLHGM/ref=sr_1_126?keywords=multivitamin+for+kids&qid=1660952888&sr=8-126
150,"NaturesPlus Childrens Vita-Gels - 90 Easy to Swallow Softgels - Natural Orange Flavor - Childrens Multivitamin & Mineral Supplement for Health, Energy - Gluten-Free - 90 Servings",156,4.3,20.95,https://www.amazon.com/Natures-Plus-Childrens-Vita-Gels-Natural/dp/B00028MVSE/ref=sr_1_127?keywords=multivitamin+for+kids&qid=1660952888&sr=8-127
151,NATURELO Whole Food Multivitamin for Teenage Boys - Vitamins and Minerals Supplement for Active Kids - with Plant Extracts - Non-GMO - Vegan & Vegetarian - 60 Capsules,447,4.7,24.95,https://www.amazon.com/NATURELO-Whole-Food-Multivitamin-Teenage/dp/B08P291YZ4/ref=sr_1_128?keywords=multivitamin+for+kids&qid=1660952888&sr=8-128
152,"Centrum Kids' Organic Multigummies, Kids Multivitamin Gummies, Organic Multivitamin for Kids with Essential Nutrients for Immune Support, Muscle Function, and Brain Health - 90 Count",906,4.7,21.09,https://www.amazon.com/gp/slredirect/picassoRedirect.html/ref=pa_sp_mtf_aps_sr_pg3_1?ie=UTF8&adId=A047945821KXSDJQ3BDJP&url=%2FCentrum-Multigummies-Multivitamin-Essential-Nutrients%2Fdp%2FB093TGWZHC%2Fref%3Dsr_1_129_sspa%3Fkeywords%3Dmultivitamin%2Bfor%2Bkids%26qid%3D1660952888%26sr%3D8-129-spons%26psc%3D1&qualifier=1660952888&id=2908298790410877&widgetName=sp_mtf
153,"Nordic Naturals Zero Sugar Kids Multi Gummies, Orange Lemon - 120 Gummies - Great-Tasting Multivitamin for Ages 4+ - Supports Growth & Development - Non-GMO, Vegetarian - 30 Servings",201,4.3,27.96,https://www.amazon.com/gp/slredirect/picassoRedirect.html/ref=pa_sp_mtf_aps_sr_pg3_1?ie=UTF8&adId=A0690184CEWU8A90914P&url=%2FNordic-Naturals-Sugar-Gummies-Orange%2Fdp%2FB08H3H9XJD%2Fref%3Dsr_1_130_sspa%3Fkeywords%3Dmultivitamin%2Bfor%2Bkids%26qid%3D1660952888%26sr%3D8-130-spons%26psc%3D1&qualifier=1660952888&id=2908298790410877&widgetName=sp_mtf
154,"Nordic Naturals Nordic Berries, Cherry Berry - 120 Gummy Berries - Great-Tasting Multivitamin for Ages 2+ - Growth, Development, Optimal Wellness - Non-GMO, Vegetarian - 30 Servings",486,4.5,21.56,https://www.amazon.com/gp/slredirect/picassoRedirect.html/ref=pa_sp_mtf_aps_sr_pg3_1?ie=UTF8&adId=A0802359392329HAVWFR8&url=%2FNordic-Naturals-Berries-Multivitamin-Gummies%2Fdp%2FB01LTHMG3Q%2Fref%3Dsr_1_131_sspa%3Fkeywords%3Dmultivitamin%2Bfor%2Bkids%26qid%3D1660952888%26sr%3D8-131-spons%26psc%3D1&qualifier=1660952888&id=2908298790410877&widgetName=sp_mtf
155,Gummy Vitamins for Kids Immune Support - Natural Children's Vitamins Supplements for Toddler and Kids Health - Kids Vitamins Gummy Multivitamin and Natural Energy Supplement with B Complex Vitamins,"2,754",4.7,12.77,https://www.amazon.com/gp/slredirect/picassoRedirect.html/ref=pa_sp_mtf_aps_sr_pg3_1?ie=UTF8&adId=A07315231XGCO9RV1OTZ1&url=%2FGummy-Vitamins-Kids-Immune-Support%2Fdp%2FB07ZL28GWV%2Fref%3Dsr_1_132_sspa%3Fkeywords%3Dmultivitamin%2Bfor%2Bkids%26qid%3D1660952888%26sr%3D8-132-spons%26psc%3D1%26smid%3DAGRU5KRHAI4EP&qualifier=1660952888&id=2908298790410877&widgetName=sp_mtf
156,"365 by Whole Foods Market, Multi Kid Cherry, 120 Chews",578,4.1,9.54,https://www.amazon.com/365-Everyday-Value-Chewable-Cherry/dp/B074H7L7CW/ref=sr_1_133?keywords=multivitamin+for+kids&qid=1660952888&sr=8-133
157,"Nature's Gummies Daily Multivitamin for Kids + Vitamins C, D3 & Zinc for Immune Support - Children's Multivitamin Chewable, Gluten Free, Non-GMO, Tasty Strawberry Flavored - 60 Gummies",253,4.6,8.42,https://www.amazon.com/Kids-Multivitamin-Gummies-Daily-Formula/dp/B08R5Q4GDZ/ref=sr_1_134?keywords=multivitamin+for+kids&qid=1660952888&sr=8-134
158,"Multivitamins for Kids Gummies - All Essential Vitamins with Vitamin D and Zinc - Gluten Free, Non-GMO, Natural Flavoring; 90 Count","1,616",4.7,17.99,https://www.amazon.com/MAV-Nutrition-Multivitamins-Kids-Gummies/dp/B07PPVDK5R/ref=sr_1_135?keywords=multivitamin+for+kids&qid=1660952888&sr=8-135
159,NATURELO Whole Food Multivitamin for Teens - Vitamins and Minerals for Teenage Boys and Girls - Supplement for Active Kids - with Organic Whole Foods - Non-GMO - Vegan & Vegetarian - 60 Capsules,"5,321",4.6,24.95,https://www.amazon.com/NATURELO-Whole-Food-Multivitamin-Teens/dp/B0774242NN/ref=sr_1_136?keywords=multivitamin+for+kids&qid=1660952888&sr=8-136
160,"Lifeable Sugar Free Multivitamin for Kids – Great Tasting Natural Flavor Gummy Supplement – with Vitamins A, C, D, E, Niacin, B6, Folate, B12, Biotin, Pantothenic Acid, Iodine, Zinc, – 90 Gummies",165,4.4,17.49,https://www.amazon.com/VitaWorks-Sugar-Free-Multivitamin-Kids/dp/B08BW3DF9C/ref=sr_1_137?keywords=multivitamin+for+kids&qid=1660952888&sr=8-137
161,"Nature’s Bounty Star Wars™ Kids Gummy Multivitamin, Natural Strawberry & Raspberry Flavored, Non-GMO, 180 Gummies",2,3.0,11.94,https://www.amazon.com/Natures-Bounty-Multivitamin-Strawberry-Raspberry/dp/B09SK5NCTC/ref=sr_1_138?keywords=multivitamin+for+kids&qid=1660952888&sr=8-138
162,"SmartyPants Kids Complete Gummy Vitamins: Multivitamin & Omega 3 DHA/EPA Fish Oil, Methyl B12, Vitamin D3, limited Valuesize pack of 180 count Total","1,143",4.8,24.49,https://www.amazon.com/SmartyPants-Kids-Complete-Gummy-Vitamins/dp/B071XBNVGW/ref=sr_1_139?keywords=multivitamin+for+kids&qid=1660952888&sr=8-139
163,"Flintstones Multivitamin Natural Fruit Bites Kids Vitamins: Vitamin D, Zinc, Vitamin B12, Biotin for Immune Support, Gluten Free, Vitamin B6, A, E, & more","1,122",4.3,none,https://www.amazon.com/Flintstones-Natural-Multivitamin-Support-Vitamins/dp/B0856Q82HW/ref=sr_1_140?keywords=multivitamin+for+kids&qid=1660952888&sr=8-140
164,Kids Vitamins Gummy Multivitamin Chewable - Kids Gummy Vitamins for Mood Support Natural Energy Boost and Immune Support for Kids - Kids Immune Support Gummies and Natural Multivitamin for Kids,459,4.7,9.99,https://www.amazon.com/Kids-Vitamins-Gummy-Multivitamin-Chewable/dp/B08D6V5VHN/ref=sr_1_141?keywords=multivitamin+for+kids&qid=1660952888&sr=8-141
165,"Nature’s Bounty Disney® and Pixar® The Incredibles Kids Gummy Multi Vitamin, 180 Gummies",3,3.9,12.49,https://www.amazon.com/Natures-Bounty-Disney%C2%AE-Incredibles-Vitamin/dp/B09SKB955K/ref=sr_1_142?keywords=multivitamin+for+kids&qid=1660952888&sr=8-142
166,"Garden of Life Dr. Formulated Probiotics Organic Kids+ Plus Vitamin C & D - Berry Cherry - Gluten, Dairy & Soy Free Immune & Digestive Health Supplement, No Added Sugar, 30 Chewables (Shelf Stable)","9,933",4.7,16.99,https://www.amazon.com/Garden-Formulated-Probiotics-Cherry-Acidophilus-Health-Gluten/dp/B074JLL5KS/ref=sr_1_143?keywords=multivitamin+for+kids&qid=1660952888&sr=8-143
167,Wellgenix Balanced Essentials Liquid Kids Vitamin - Nutritional Multivitamin for Picky Eaters - Boost Children Immune System and Overall Health 16 Oz (1),133,3.6,29.94,https://www.amazon.com/Balanced-Essentials-Kids-Liquid-Multivitamin/dp/B07TTK253C/ref=sr_1_144?keywords=multivitamin+for+kids&qid=1660952888&sr=8-144
168,"Nature’s Way Alive! Kids Multivitamin Gummy, 15 Vitamins & Minerals, Gelatin-Free, Cherry, Orange, and Grape Flavored, 60 Gummies",674,4.5,none,https://www.amazon.com/Natures-Way-Childrens-Multivitamin-serving/dp/B007L0DE14/ref=sr_1_145?keywords=multivitamin+for+kids&qid=1660952888&sr=8-145
169,"Nature's Way Happy & Healthy Multivitamin for Kids with Vitamin C, Zinc and Elderberry, 60 Gummies","2,351",4.3,14.99,https://www.amazon.com/Natures-Way-Healthy-Multivitamin-Elderberry/dp/B089MXBNQB/ref=sr_1_146?keywords=multivitamin+for+kids&qid=1660952888&rdc=1&sr=8-146
170,"Organic Kids Multivitamin Gummies [USDA Yummy Children Vitamins Gummy] with Vitamin C, D, A, B, and Zinc for Immunity, Growth, Brain, Energy, Vegetarian, Gluten Free, 60 Chews",19,4.4,14.97,https://www.amazon.com/Multivitamin-Children-Vitamins-Immunity-Vegetarian/dp/B09LVLPFXV/ref=sr_1_147?keywords=multivitamin+for+kids&qid=1660952888&sr=8-147
171,Seeking Health | Kid's Optimal Multivitamin | Potent Nutrients & Bioavailable Vitamins Formulated for Children | Iron-and Copper-Free | Free of Common Allergens | 180 Vegetarian Capsules | 30 Servings,118,4.4,32.95,https://www.amazon.com/Seeking-Health-Multivitamin-Vegetarian-Supplement/dp/B00TRLLUW0/ref=sr_1_148?keywords=multivitamin+for+kids&qid=1660952888&sr=8-148
172,"Sundown Kids Marvel Avengers Multivitamin Gummies, Vitamins A, C, D, E, Gluten-Free, Dairy-Free, Peanut-Free, 180 Count 68456","1,856",4.7,none,https://www.amazon.com/Sundown-Naturals%C2%AE-Kids-Avengers%C2%AE-Multivitamin/dp/B06WV86DFF/ref=sr_1_149?keywords=multivitamin+for+kids&qid=1660952888&sr=8-149
173,"Best Nest Multi+ for Kids, Liquid Multivitamin, Methylfolate (Folic Acid), Methylcobalamin, Complete, Natural Whole Food Blend, Prebiotics, Immune Support, Tropical Flavor, 16 oz, Best Nest Wellness",303,4.4,35.00,https://www.amazon.com/Best-Nest-L-Methylfolate-Methylcobalamin-Wellness/dp/B072J513XH/ref=sr_1_150?keywords=multivitamin+for+kids&qid=1660952888&sr=8-150
174,Centrum Minis Adult 50+ (320 Count) Multivitamin/Multimineral Supplement Tablets,"3,956",4.7,15.99,https://www.amazon.com/Centrum-Multivitamin-Multimineral-Supplement-Tablets/dp/B08FVZ3C19/ref=sr_1_151?keywords=multivitamin+for+kids&qid=1660952888&sr=8-151
175,"NaturesPlus Animal Parade Source of Life Gold Children's Multivitamin - Grape Flavor - 120 Chewable Animal Shaped Tablets - Vegetarian, Gluten-Free - 60 Servings",209,4.6,28.42,https://www.amazon.com/Natures-Plus-Animal-Childrens-Multivitamin/dp/B00553PAHU/ref=sr_1_152?keywords=multivitamin+for+kids&qid=1660952888&sr=8-152
176,"Bio Naturals Children's Liquid Multivitamin & Immune Booster - Natural Supplement for Kids & Toddlers with Vitamins A B C D3 E, Fiber, Fruits & Vegetables - No GMOs, Gluten, Sugar, Dairy, Soy - 16oz",346,4.2,29.95,https://www.amazon.com/Childrens-Liquid-Multivitamin-Supplement-Vegetables/dp/B074CKYGR9/ref=sr_1_153?keywords=multivitamin+for+kids&qid=1660952888&sr=8-153
177,Kirkman Children’s Multivitamin & Mineral Chewable with 5-MTHF,20,4.5,25.88,https://www.amazon.com/Kirkman-Childrens-Chewable-Multi-Vitamin-Supplementation/dp/B079THQ43Y/ref=sr_1_154?keywords=multivitamin+for+kids&qid=1660952888&sr=8-154
178,Olly Kids Multivitamin Gummy! 70 Gummies Sour Fruity Punch Flavor! Blend of Daily Vitamins and Minerals! Help Fill Any Nutritional Gaps and Promote Overall Wellness! Choose Your Pack! (3 Pack),42,4.8,49.25,https://www.amazon.com/Olly-Multivitamin-Gummy-Vitamins-Nutritional/dp/B081V4NRBM/ref=sr_1_155?keywords=multivitamin+for+kids&qid=1660952888&sr=8-155
179,"Zarbee's Children's Elderberry Immune Support Gummies with Vitamin C, Zinc, Natural Berry Flavor, 70 Count","3,697",4.8,25.47,https://www.amazon.com/Zarbees-Naturals-Childrens-Elderberry-Support/dp/B0973V3MX9/ref=sr_1_156?keywords=multivitamin+for+kids&qid=1660952888&sr=8-156
180,"Centrum Kids Multivitamin Gummies, Tropical Punch Flavor Made with Natural Flavors, 110 Count, 110 Day Supply",353,4.8,10.47,https://www.amazon.com/gp/slredirect/picassoRedirect.html/ref=pa_sp_atf_next_aps_sr_pg4_1?ie=UTF8&adId=A00169183KVV49W94TP6S&url=%2FCentrum-Multivitamin-Gummies-Tropical-Natural%2Fdp%2FB09WYRNPLJ%2Fref%3Dsr_1_145_sspa%3Fkeywords%3Dmultivitamin%2Bfor%2Bkids%26qid%3D1660952896%26sr%3D8-145-spons%26psc%3D1&qualifier=1660952896&id=2155499946219675&widgetName=sp_atf_next
181,"ChildLife Essentials, Kids Liquid Multivitamin and Mineral Supplement - Liquid Vitamins for Kids, All-Natural, Gluten-Free, Non-GMO - Natural Orange & Mango Flavor, 8 Ounce Bottle (Pack of 2)","1,291",4.6,26.95,https://www.amazon.com/gp/slredirect/picassoRedirect.html/ref=pa_sp_atf_next_aps_sr_pg4_1?ie=UTF8&adId=A10059391FD4OXGLIL5D6&url=%2FChildlife-Vitamin-Mineral-Natural-Orange%2Fdp%2FB012ETVGD4%2Fref%3Dsr_1_146_sspa%3Fkeywords%3Dmultivitamin%2Bfor%2Bkids%26qid%3D1660952896%26sr%3D8-146-spons%26psc%3D1&qualifier=1660952896&id=2155499946219675&widgetName=sp_atf_next
182,"SmartyPants Teen Guy Formula, Daily Multivitamin Gummies: Vitamins C, B12, K, Zinc, & Biotin for Immune Support, Energy, Skin & Hair Support, Assorted Fruit Flavor, 120 Gummies (30 Day Supply)","11,302",4.5,16.37,https://www.amazon.com/gp/slredirect/picassoRedirect.html/ref=pa_sp_atf_next_aps_sr_pg4_1?ie=UTF8&adId=A0161561UVUQ4JE7AWYY&url=%2FSmartyPants-Complete-Daily-Gummy-Vitamins%2Fdp%2FB0741FTPXD%2Fref%3Dsr_1_147_sspa%3Fkeywords%3Dmultivitamin%2Bfor%2Bkids%26qid%3D1660952896%26sr%3D8-147-spons%26psc%3D1&qualifier=1660952896&id=2155499946219675&widgetName=sp_atf_next
183,MaryRuth's L Theanine 200mg Liquid Drops | L-Theanine + Organic Glycerin | Stress Relief for Adults & Kids | Focus Supplement | Natural Sleep Support | Vegan | Non-GMO | Gluten Free | 30 Servings,55,4.6,24.95,https://www.amazon.com/gp/slredirect/picassoRedirect.html/ref=pa_sp_atf_next_aps_sr_pg4_1?ie=UTF8&adId=A0642201LOT1OKYZY97G&url=%2FMaryRuths-Theanine-L-Theanine-Glycerin-Supplement%2Fdp%2FB09YKGM7N5%2Fref%3Dsr_1_148_sspa%3Fkeywords%3Dmultivitamin%2Bfor%2Bkids%26qid%3D1660952896%26sr%3D8-148-spons%26psc%3D1%26smid%3DA3V1QNHQ2M2TBN&qualifier=1660952896&id=2155499946219675&widgetName=sp_atf_next
184,"OLLY Family 2 Pack: Women's Multivitamin Gummy (90 Count), Kids Multivitamin + Probiotic Gummy (70 Count), Vitamins A, D, C, E, B, Chewable Supplements, Blissful Berry & Yum Berry Punch - 160 Count",127,4.6,25.37,https://www.amazon.com/OLLY-Family-Pack-Multivitamin-Supplements/dp/B0954DV4T9/ref=sr_1_149?keywords=multivitamin+for+kids&qid=1660952896&sr=8-149
185,"NaturesPlus Animal Parade Source of Life Gold Children's Liquid Multivitamin, 16 OZ - Natural Tropical Berry Flavor - Immune Support Supplement - Gluten-Free, Vegan- 32 Servings",232,4.4,19.11,https://www.amazon.com/Natures-Plus-Animal-Childrens-Multivitamin/dp/B004LW6KH0/ref=sr_1_150?keywords=multivitamin+for+kids&qid=1660952896&sr=8-150
186,Hello Bello Organic Kid’s Multi Vitamin Gummy – 60ct (Pack of 1),27,4.7,11.99,https://www.amazon.com/Hello-Upsy-Daisy-Organic-Vitamins-Gummies/dp/B081S87J73/ref=sr_1_151?keywords=multivitamin+for+kids&qid=1660952896&sr=8-151
187,Multivitamin with Iron Gummies for Kids - Chewable Iron Gummy Vitamins for Kids Focus Aid and Natural Energy Supplement - Kids Gummy Vitamins with Iron for Immune Support Mental Clarity and Focus,434,4.3,14.99,https://www.amazon.com/Multivitamin-Iron-Gummies-Kids-Supplement/dp/B08LDYLZ5Q/ref=sr_1_152?keywords=multivitamin+for+kids&qid=1660952896&sr=8-152
188,"Yummi Bears Organics Complete Multi Vitamin and Mineral Supplement, Gummy Vitamins for Kids, 90 Count (Pack of 1)",958,4.6,24.02,https://www.amazon.com/Yummi-Bears-Organics-Vitamins-Multi-Vitamin/dp/B002XUL2HA/ref=sr_1_153_mod_primary_new?keywords=multivitamin+for+kids&qid=1660952896&sbo=RZvfv%2F%2FHxDF%2BO5021pAnSA%3D%3D&sr=8-153
189,"Bluebonnet Nutrition Rainforest Animalz Whole Food Based Multiple Chewable Tablet, Kids Multivitamin & Mineral, Vitamin C, D3, Iron, Gluten Free, Milk Free, Kosher, 180 Chewable Tablets, Cherry Flavor",77,4.3,28.76,https://www.amazon.com/Bluebonnet-Nutrition-Rainforest-Multiple-Multivitamin/dp/B0064O9ZH0/ref=sr_1_154?keywords=multivitamin+for+kids&qid=1660952896&sr=8-154
190,"Children's Multivitamin | 180 Chewables | Berry Flavor Tablets | Non-GMO, Gluten Free Kids Supplement | by Carlyle",63,4.2,14.99,https://www.amazon.com/Carlyle-Childrens-Multivitamin-Chewables-Supplement/dp/B08VN3ZHR9/ref=sr_1_155?keywords=multivitamin+for+kids&qid=1660952896&sr=8-155
191,NaturesPlus Animal Parade Source of Life Children's Multivitamin - Watermelon Flavor - 90 Animal Shaped Chewable Tablets (45 Servings),98,4.8,15.95,https://www.amazon.com/NaturesPlus-Animal-Parade-Childrens-Multivitamin/dp/B000Z949B2/ref=sr_1_156?keywords=multivitamin+for+kids&qid=1660952896&sr=8-156
192,"NaturesPlus Animal Parade Source of Life Gold Children's Multivitamin - Assorted Cherry, Orange & Grape Flavors - 120 Chewable Animal Shaped Tablets - Vegetarian, Gluten-Free - 60 Servings","1,434",4.6,27.65,https://www.amazon.com/Natures-Plus-Animal-Gold-Childrens-Multi-Vitamin/dp/B00553PALQ/ref=sr_1_157?keywords=multivitamin+for+kids&qid=1660952896&sr=8-157
193,"BaKol Vegan Chewable Multivitamin Gummies with 21 Multivitamins and Minerals - 60 Chewable Adult and Kids Vitamins for Immune Support, Healthy Teeth and Skin (Strawberry)",107,4.2,12.99,https://www.amazon.com/Chewable-Multivitamin-Gummies-Multivitamins-Minerals/dp/B09W8NDT52/ref=sr_1_158?keywords=multivitamin+for+kids&qid=1660952896&sr=8-158
194,"Kids Daily Iron+ Gummies by Squiggles 100ct. | All-Natural, Low Sugar, and Super Yummy | Daily Dose of Iron + Boost of Vitamins and Minerals.","1,221",4.4,22.95,https://www.amazon.com/Gummies-Squiggles-All-Natural-Vitamins-Minerals/dp/B07K6Y1BXK/ref=sr_1_159?keywords=multivitamin+for+kids&qid=1660952896&sr=8-159
195,"Kids Superfruit Vitamin Gummy | Kids Vitamins are Plant-Based, Vegan, Gluten-Free, Gelatin-Free | Fruits Include Acai, Banana, Apples, Mangos & More",50,4.4,16.97,https://www.amazon.com/Superfruit-Vitamin-Plant-Based-Gluten-Free-Gelatin-Free/dp/B09NXP4G56/ref=sr_1_160?keywords=multivitamin+for+kids&qid=1660952896&sr=8-160
196,"Nommy Bears MULTIVITAMIN Gelatin-Free Gummies: for Kids, Children, Teens, Nom Nom Yummy, 5 Delicious Flavors, 11 Essentials, Gluten-Free, Halal Certified, Mommy Approved, Bear Shapes, Vegetarian",624,4.7,19.50,https://www.amazon.com/Multivitamin-Vegetarian-Vitamins-Gluten-Free-Dairy-Free/dp/B06Y1JPLLS/ref=sr_1_161?keywords=multivitamin+for+kids&qid=1660952896&sr=8-161
197,Kids Multivitamin Omega-3 Topical Patches - 30 Days Supply,30,4.6,18.49,https://www.amazon.com/Kids-Multivitamin-Omega-3-Topical-Patches/dp/B09HTB4PHH/ref=sr_1_162?keywords=multivitamin+for+kids&qid=1660952896&sr=8-162
198,"Garden of Life Probiotics for Kids, Cherry Flavor Gummies - Sugar Free Once Daily Kids Probiotic Gummies, 3 Billion CFU Probiotics Plus Fiber for Digestive & Immune Health, 30 Vegetarian Gummies",282,4.6,20.99,https://www.amazon.com/Garden-Life-Probiotic-Billion-Gummies/dp/B07TN3LC5N/ref=sr_1_163?keywords=multivitamin+for+kids&qid=1660952896&rdc=1&sr=8-163
199,"NaturesPlus Animal Parade Source of Life Children's Chewable Multivitamin - 90 Animal-Shaped Tablets, Pack of 2 - Natural Assorted Flavors - Vegan, Gluten Free - 90 Total Servings",75,4.6,31.90,https://www.amazon.com/NaturesPlus-Animal-Childrens-Chewable-Multivitamin/dp/B01JKSHN6G/ref=sr_1_164?keywords=multivitamin+for+kids&qid=1660952896&sr=8-164
200,Pure Encapsulations Junior Nutrients | Multivitamin and Mineral Supplement Without Iron for Children Ages 4 and Up* | 120 Capsules,506,4.6,26.60,https://www.amazon.com/Pure-Encapsulations-Nutrients-Hypoallergenic-Multivitamin/dp/B004GY94BW/ref=sr_1_165?keywords=multivitamin+for+kids&qid=1660952896&sr=8-165
201,"Sundown Kids Disney Frozen 2 Multivitamin Gummies, Vitamins A, C, D, E, Gluten-Free, Dairy-Free, Peanut-Free, 60 Count","5,988",4.8,none,https://www.amazon.com/Sundown-Naturals-Kids-Complete-Multivitamin/dp/B06W9FYXD5/ref=sr_1_166?keywords=multivitamin+for+kids&qid=1660952896&sr=8-166
202,"Kids Multivitamin Gummies & Vegan Omega 3 Gummies for Kids Bundle by MaryRuth's | Immune Support | Omega 3 Supplement with Vitamin C, Vitamin E, Flaxseed Oil | Brain Health | No Fish Taste",5,5.0,42.32,https://www.amazon.com/Multivitamin-Gummies-MaryRuths-Supplement-Flaxseed/dp/B0B1GF214Z/ref=sr_1_167?keywords=multivitamin+for+kids&qid=1660952896&sr=8-167
203,"Herbaland Vegan Multivitamins Gummies for Kids - 10+ Essential Vitamins, Vitamin A, C, D3, E, B6, B12, Zinc, Sugar-Free Chewable Supplements for Toddlers - 4.4 Grams, Organic Fruit Flavor, 90 Count",166,4.6,14.00,https://www.amazon.com/HERBALAND-Kids-Multivitamin-Gummy-Count/dp/B076FGF7TY/ref=sr_1_168?keywords=multivitamin+for+kids&qid=1660952896&sr=8-168
204,"Wellvites Kids Multivitamin Gummies - Sugar Free, Vegan, Non-GMO – Vitamins for Kids - Vitamin A, D, B6, B12 and C - No Artificial Sweeteners, Gluten Free, Gelatin Free - 60 Count (30 Day Supply)",762,4.7,18.95,https://www.amazon.com/Wellvites-Multivitamin-Complete-Sugar-Vitamins/dp/B07NQRBV47/ref=sr_1_169?keywords=multivitamin+for+kids&qid=1660952896&sr=8-169
205,Vitamin C Supplement for Kids | USDA Organic Vitamin C Liquid Drops for Kids Ages 1-3 | Vitamin for Immune Support & Overall Health | Vegan | Non-GMO | Gluten Free | 1 Fl Oz,"1,471",4.8,20.95,https://www.amazon.com/Organic-Vitamin-Liquid-MaryRuths-Support/dp/B087DRSXBG/ref=sr_1_170?keywords=multivitamin+for+kids&qid=1660952896&sr=8-170
206,"Jamieson Multivitamin for Kids, 60 chewable tabs",1,5.0,29.99,https://www.amazon.com/Jamieson-Multivitamin-Kids-chewable-tabs/dp/B01K482FM8/ref=sr_1_171?keywords=multivitamin+for+kids&qid=1660952896&sr=8-171
207,"Garden of Life Multivitamin for Women, Men & Kids Age 6 and up, Vitamin Code Family Multi - 120 Vegetarian Capsules, Whole Food Vitamins, Food Blend & Probiotics, Gluten Free Dietary Supplements",796,4.8,32.19,https://www.amazon.com/Garden-Life-Family-Multivitamin-Supplement/dp/B00280M10C/ref=sr_1_172?keywords=multivitamin+for+kids&qid=1660952896&rdc=1&sr=8-172
208,"Noor Vitamins Kids Formula Daily Chewable Multivitamin: Essential Vitamins For Immune, Bone & Eye Health with Iron - Non GMO & Gluten Free - Halal Vitamins 60 Count (2 Month Supply)",354,4.5,14.49,https://www.amazon.com/NoorVitamins-Childrens-Chewable-Multivitamins-Iron/dp/B005E9O5IU/ref=sr_1_173?keywords=multivitamin+for+kids&qid=1660952896&sr=8-173
209,"Trace Minerals Kids Multi-Vitamin/Mineral Supplement, Great Tasting Childrens Vitamin, Fast-Absorbing Liquid Formula, Citrus Punch, 8-Ounce Bottle, 72 Ionic Minerals, Healthy Bones, Immunity (1)",234,4.3,17.99,https://www.amazon.com/Trace-Minerals-Multi-Vitamin-Supplement-Fast-Absorbing/dp/B000JKVCBM/ref=sr_1_174?keywords=multivitamin+for+kids&qid=1660952896&sr=8-174
210,"ChildLife Essentials Multi Vitamin & Mineral, Natural Orange/Mango Flavor - Gluten Free, Alcohol Free, Casein Free, Non-GMO - 8 fl. oz (Pack of 3)",718,4.7,33.99,https://www.amazon.com/Child-Multi-Vitamin-Mineral-8-Ounce/dp/B07DF7RM2S/ref=sr_1_175?keywords=multivitamin+for+kids&qid=1660952896&sr=8-175
