,description,number_rates,rating,price,url
278,"Garden of Life Dr. Formulated Attention and Focus for Kids, Supplement Promotes Healthy Brain Function, Concentration with Organic Wild Blueberry, Pine Bark, Vitamin C, D and Probiotics, 60 Count","1,157",4.0,21.11,https://www.amazon.com/Garden-Life-Formulated-Health-Attention/dp/B076ZJX46Y/ref=sr_1_231?keywords=multivitamin+for+kids&qid=1660952911&sr=8-231
279,"Garden of Life Kids Immune Support Gummies with Vitamin C, D as D3 & Zinc for 3-in-1 Daily Children’s Immunity – Organic, Non-GMO, Gluten-Free, Vegetarian, Sugar Free, Cherry Flavor, 30 Day Supply","1,604",4.7,23.29,https://www.amazon.com/Garden-Life-Immune-Cherry-Flavor/dp/B07TR64MJH/ref=sr_1_232?keywords=multivitamin+for+kids&qid=1660952911&sr=8-232
280,"NOW Foods Kid Vits Multivitamin Tabs, Berry Blast, 120 Chewables",116,4.0,13.00,https://www.amazon.com/NOW-Foods-Multivitamin-Berry-Chewables/dp/B000WPS7US/ref=sr_1_233?keywords=multivitamin+for+kids&qid=1660952911&sr=8-233
281,"NaturesPlus Animal Parade Source of Life Children's Multivitamin Gummies - 50 Animal Shaped Gummies - Natural Assorted Flavors - Promotes Health and Wellbeing - Vegetarian, Gluten-Free - 25 Servings",36,3.5,22.45,https://www.amazon.com/Natures-Plus-Gummies-Assorted-Tablets/dp/B0001588M6/ref=sr_1_234?keywords=multivitamin+for+kids&qid=1660952911&sr=8-234
282,"SmartyPants Kids Formula Daily Gummy Vitamins: Gluten Free, Multivitamin & Omega 3 Fish Oil (Dha/Epa), Methyl B12, vitamin D3, Vitamin B6, 90Count (22 Day Supply) - Packaging May Vary","1,178",4.6,10.99,https://www.amazon.com/SmartyPants-Complete-Daily-Gummy-Vitamins/dp/B01FB8WBHK/ref=sr_1_235?keywords=multivitamin+for+kids&qid=1660952911&sr=8-235
283,Dr. Mercola Children's Multivitamin Chewables Fruit - 60 Tablets,176,4.4,34.99,https://www.amazon.com/Mercola-Childrens-Chewables-Multivitamin/dp/B00B5HOJF4/ref=sr_1_236?keywords=multivitamin+for+kids&qid=1660952911&sr=8-236
284,Mary Ruth's 5-1 Immunity Gummies with Elderberry for Kids & Adults | Cherry | Pectin Based | Vegan | 90 Count,"4,781",4.7,27.99,https://www.amazon.com/Elderberry-Gummies-Vitamins-Overall-Wellness/dp/B07Q3ZTSW2/ref=sr_1_237?keywords=multivitamin+for+kids&qid=1660952911&sr=8-237
285,Vegan Vitamin C Gummies by MaryRuth's | 2 Month Supply | Great Tasting Plant-Based Formula Supports Immune Function & Overall Health for Adults & Kids | Non-GMO with 125 mg of Vitamin C Per Gummy,"3,322",4.7,22.95,https://www.amazon.com/Vitamin-Gummy-Vegan-Organic-Plant-Based/dp/B07CNFJPCY/ref=sr_1_238?keywords=multivitamin+for+kids&qid=1660952911&sr=8-238
286,"Calcium, Magnesium, Zinc & Vitamin D Gummies - 2 Pack | Vitamins for Women, Men & Kids | Calcium Supplements for Strong Healthy Bones, Zinc Gummies, Gluten-Free, Vegan - 120 Count",149,4.4,28.99,https://www.amazon.com/Calcium-Magnesium-Zinc-Vitamin-Gummies/dp/B09L4V9CLF/ref=sr_1_239?keywords=multivitamin+for+kids&qid=1660952911&sr=8-239
287,"Floradix, Kinder Love Vegan Children’s Liquid Multivitamin for Healthy Development, 8.5 Oz",1,5.0,25.31,https://www.amazon.com/Floradix-Childrens-Multivitamin-Healthy-Development/dp/B098QMJYNS/ref=sr_1_240?keywords=multivitamin+for+kids&qid=1660952911&sr=8-240
288,Organic Kids Multivitamin Gummies - Children's and Toddler Chewable Gummy Multivitamins - Vegan Ingredients Kids Vitamins for Children - 30 Day Supply,111,4.3,7.50,https://www.amazon.com/Organic-Kids-Multivitamin-Gummies-Multivitamins/dp/B09BG4PCS7/ref=sr_1_241?keywords=multivitamin+for+kids&qid=1660952911&sr=8-241
289,"Rainbow Light Kid's One Food-Based Multivitamin (2 Packs of 90) - Chewable Probiotic, Vitamin and Mineral Supplement; Supports Brain, Bone, Heart, Eye and Immune Health in Kids Gluten Free",16,4.6,54.99,https://www.amazon.com/Rainbow-Light-Food-Based-Multivitamin-Packs/dp/B07F3XHWXD/ref=sr_1_242?keywords=multivitamin+for+kids&qid=1660952911&sr=8-242
290,"SmartyPants Kids Complete Daily Gummy Vitamins, Gluten Free, Multivitamin & Omega 3 Fish OilDHA/EPA Fatty Acids (180 Count)",11,4.5,23.49,https://www.amazon.com/SmartyPants-Complete-Gummy-Vitamins-Multivitamin/dp/B07H228KM4/ref=sr_1_243_mod_primary_new?keywords=multivitamin+for+kids&qid=1660952911&sbo=RZvfv%2F%2FHxDF%2BO5021pAnSA%3D%3D&sr=8-243
291,"NutraBulk Children's Chewable Multi-Vitamin Tablets for Kids to Support Immune, Bone, and Brain, Contains All Natural Vitamins, Minerals, B Complex. Cherry Flavor (250 Count)",216,4.5,20.99,https://www.amazon.com/NutraBulk-Childrens-Chewable-Multi-Vitamin-Tablets/dp/B017URHWJ2/ref=sr_1_244?keywords=multivitamin+for+kids&qid=1660952911&sr=8-244
292,"Nighttime Liquid Multimineral Supplement | Sugar Free | Natural Sleep Support for Adults & Kids | NO Melatonin | Magnesium, Calcium & MSM | Available in 4 Flavors | Vegan | Gluten Free | 32 Servings","13,908",4.2,39.95,https://www.amazon.com/Multimineral-MaryRuth-Vitamins-Minerals-Magnesium/dp/B00O9MT12S/ref=sr_1_245?keywords=multivitamin+for+kids&qid=1660952911&sr=8-245
293,"Vitamin Friends Strawberry Jam Flavored Iron Gummies - Vegan (60 Day Supply) - Vegan (60 Day Supply) Ferrous Fumarate B-Complex, Vitamin C, Zinc, Biotin - Iron Kids Gummies Supplement",779,4.1,21.99,https://www.amazon.com/Vitamin-Friends-Strawberry-Flavored-Gummies/dp/B08NWJ36CD/ref=sr_1_246?keywords=multivitamin+for+kids&qid=1660952911&sr=8-246
294,"NaturesPlus Animal Parade Source of Life Sugar-Free Children's Multivitamin - Assorted Cherry, Orange & Grape Flavors - 90 Chewable Tablets - 45 Servings",66,4.4,19.90,https://www.amazon.com/Natures-Plus-Sugar-Free-Childrens-Multivitamin/dp/B004AOJN4G/ref=sr_1_247?keywords=multivitamin+for+kids&qid=1660952911&sr=8-247
295,"American Gummies Halal Multivitamin for Kids: Natural Fruit Flavored Gummies for Healthy Brain, Heart, Skin and Eyes, 130 Gummies",9,4.8,22.99,https://www.amazon.com/American-Gummies-Halal-Multivitamin-Kids/dp/B091V5BMQC/ref=sr_1_248?keywords=multivitamin+for+kids&qid=1660952911&sr=8-248
296,"up4 Kids Probiotic Gummies, Digestive and Immune Support with Prebiotics and Vitamin C, Gelatin Free, Gluten Free and Non-GMO, For Ages 3+, 30 count","5,030",4.7,11.99,https://www.amazon.com/up4-Probiotic-Digestive-Gelatin-free-prebiotic/dp/B07H8P1YDJ/ref=sr_1_249?keywords=multivitamin+for+kids&qid=1660952911&sr=8-249
297,"Culturelle Kids Immune Defense Probiotic Chewables with Vitamin C, Vitamin D and Zinc + Elderberry, 4-in-1 Immune Support for Kids Ages 3+*, Mixed Berry Chewables, 30 Count","1,908",4.7,21.90,https://www.amazon.com/Culturelle-Defense-Probiotic-Elderberry-Chewables/dp/B08DKQV6H1/ref=sr_1_250?keywords=multivitamin+for+kids&qid=1660952911&sr=8-250
298,"Total Nutra 6-in-1 Liquid Multivitamin Supplement | 100% Daily Zinc, Vitamin D3 and Vitamin C Immunity Drops | Elderberry, Echinacea & Ginger Defense Support for Adults & Kids | 4 oz Passion Fruit",919,4.3,17.80,https://www.amazon.com/Total-Nutra-Multivitamin-Supplement-Elderberry/dp/B08TJ72G4B/ref=sr_1_251?keywords=multivitamin+for+kids&qid=1660952911&sr=8-251
299,America Medic & Science PediaWell Complete (50mlL) | Liquid Multivitamin for Kids | Iron Supplement with Vitamins A and C for Babies and Toddlers | Vitamin Drops for Enhanced Growth and Development,1,5.0,11.99,https://www.amazon.com/America-Medic-Science-Multivitamin-Development/dp/B09PLLZJ8Z/ref=sr_1_252?keywords=multivitamin+for+kids&qid=1660952911&sr=8-252
300,"Centrum Kids Multivitamin Gummies, Tropical Punch Flavor Made with Natural Flavors, 110 Count, 110 Day Supply",353,4.8,10.47,https://www.amazon.com/gp/slredirect/picassoRedirect.html/ref=pa_sp_atf_next_aps_sr_pg6_1?ie=UTF8&adId=A00169183KVV49W94TP6S&url=%2FCentrum-Multivitamin-Gummies-Tropical-Natural%2Fdp%2FB09WYRNPLJ%2Fref%3Dsr_1_241_sspa%3Fkeywords%3Dmultivitamin%2Bfor%2Bkids%26qid%3D1660952918%26sr%3D8-241-spons%26psc%3D1&qualifier=1660952918&id=958870467690463&widgetName=sp_atf_next
301,"ChildLife Essentials, Kids Liquid Multivitamin and Mineral Supplement - Liquid Vitamins for Kids, All-Natural, Gluten-Free, Non-GMO - Natural Orange & Mango Flavor, 8 Ounce Bottle (Pack of 2)","1,291",4.6,26.95,https://www.amazon.com/gp/slredirect/picassoRedirect.html/ref=pa_sp_atf_next_aps_sr_pg6_1?ie=UTF8&adId=A10059391FD4OXGLIL5D6&url=%2FChildlife-Vitamin-Mineral-Natural-Orange%2Fdp%2FB012ETVGD4%2Fref%3Dsr_1_242_sspa%3Fkeywords%3Dmultivitamin%2Bfor%2Bkids%26qid%3D1660952918%26sr%3D8-242-spons%26psc%3D1&qualifier=1660952918&id=958870467690463&widgetName=sp_atf_next
302,MaryRuth's L Theanine 200mg Liquid Drops | L-Theanine + Organic Glycerin | Stress Relief for Adults & Kids | Focus Supplement | Natural Sleep Support | Vegan | Non-GMO | Gluten Free | 30 Servings,55,4.6,24.95,https://www.amazon.com/gp/slredirect/picassoRedirect.html/ref=pa_sp_atf_next_aps_sr_pg6_1?ie=UTF8&adId=A0642201LOT1OKYZY97G&url=%2FMaryRuths-Theanine-L-Theanine-Glycerin-Supplement%2Fdp%2FB09YKGM7N5%2Fref%3Dsr_1_243_sspa%3Fkeywords%3Dmultivitamin%2Bfor%2Bkids%26qid%3D1660952918%26sr%3D8-243-spons%26psc%3D1%26smid%3DA3V1QNHQ2M2TBN&qualifier=1660952918&id=958870467690463&widgetName=sp_atf_next
303,"Nordic Naturals Nordic Berries, Cherry Berry - 120 Gummy Berries - Great-Tasting Multivitamin for Ages 2+ - Growth, Development, Optimal Wellness - Non-GMO, Vegetarian - 30 Servings",486,4.5,21.56,https://www.amazon.com/gp/slredirect/picassoRedirect.html/ref=pa_sp_atf_next_aps_sr_pg6_1?ie=UTF8&adId=A0802359392329HAVWFR8&url=%2FNordic-Naturals-Berries-Multivitamin-Gummies%2Fdp%2FB01LTHMG3Q%2Fref%3Dsr_1_244_sspa%3Fkeywords%3Dmultivitamin%2Bfor%2Bkids%26qid%3D1660952918%26sr%3D8-244-spons%26psc%3D1&qualifier=1660952918&id=958870467690463&widgetName=sp_atf_next
304,Smartypants Multivitamin - Kids Complete And Fiber Gummy - 120 Count,31,4.1,24.76,https://www.amazon.com/Smartypants-Multivitamin-Complete-Fiber-Gummy/dp/B07CQ5X21W/ref=sr_1_245?keywords=multivitamin+for+kids&qid=1660952918&sr=8-245
305,"Iron Gummies for Adults and Kids, Chewable Multivitamin Supplement with Iron, Vitamin C, A, B, Zinc, Folic Acid, and Biotin (Grape Flavored) Vegan Safe, Made in The USA from HERBATECH","1,664",4.3,16.95,https://www.amazon.com/Chewable-Multivitamin-Supplement-Flavored-HERBATECH/dp/B085N8S39B/ref=sr_1_246?keywords=multivitamin+for+kids&qid=1660952918&sr=8-246
306,"Natrol Kids Sleep+ Immune Health Aid Gummies with Melatonin, Zinc, Vitamin C and D, Elderberry, 50 Count","2,517",4.7,9.99,https://www.amazon.com/Natrol-Melatonin-Elderberry-Vitamin-Gummies/dp/B08V56KPKM/ref=sr_1_247?keywords=multivitamin+for+kids&qid=1660952918&sr=8-247
307,"NaturesPlus Animal Parade Source of Life Children's Chewable Multivitamin - Grape Flavor - 90 Animal Shaped Tablets - Promotes Health and Wellbeing - Vegetarian, Gluten-Free - 45 Servings",93,4.7,15.95,https://www.amazon.com/NaturesPlus-Animal-Childrens-Chewable-Multivitamin/dp/B0001VU5NK/ref=sr_1_248?keywords=multivitamin+for+kids&qid=1660952918&sr=8-248
308,Douglas Laboratories Ultra Preventive Kids | Children's Chewable MultiVitamin & Mineral | 60 Tablets | Orange Flavor,72,4.3,24.45,https://www.amazon.com/Douglas-Laboratories-Preventive-Multivitamin-Supplement/dp/B006JG6I7S/ref=sr_1_249?keywords=multivitamin+for+kids&qid=1660952918&sr=8-249
309,"CLINICAL DAILY Complete Kids Multivitamin Daily Gummy Supplement for Brain, Vision, Bone and Immune Health. Vitamins A, C, E,D,B6,B12, Folate, Biotin, Essential Minerals. 90 Gluten Free Yummy Gummies",80,4.5,16.99,https://www.amazon.com/COMPLETE-Multivitamin-Supplement-Superheroes-everywhere/dp/B07BYTVL8R/ref=sr_1_250?keywords=multivitamin+for+kids&qid=1660952918&sr=8-250
310,"Feel Great Vitamin Co. Complete DHA Gummies for Kids | with Omega 3 6 9 + DHA, Vitamin C | Supports Healthy Brain Function, Vision & Heart Health | Gluten Free, Vegetarian & Non-GMO | 60 Gummies","4,665",4.4,21.97,https://www.amazon.com/Complete-Feel-Great-365-Supplement/dp/B06Y1C5DHC/ref=sr_1_251?keywords=multivitamin+for+kids&qid=1660952918&sr=8-251
311,"Yummi Bears Complete Multivitamin and Mineral Supplement, Gummy Vitamins for Kids, 90 Count (Pack of 1)",800,4.5,17.05,https://www.amazon.com/Yummi-Bears-Multi-Vitamin-Mineral-Vitamin/dp/B001AZTD66/ref=sr_1_252?keywords=multivitamin+for+kids&qid=1660952918&sr=8-252
312,Plexus Slim Xfactor Kids MultiVitamin Probiotic Supplement 60 Chewable Tablets,17,4.7,51.00,https://www.amazon.com/Plexus-MultiVitamin-Probiotic-Supplement-Chewable/dp/B08NK42197/ref=sr_1_253?keywords=multivitamin+for+kids&qid=1660952918&sr=8-253
313,"Multivitamin Gummies | Vegan Friendly, Kosher Halal NO Gluten or Gelatin, no GMO| for Men, Women & Kids| 3 Natural Flavors | Vitamins C, B3, B12, Biotin, Zinc & More| 100 Gummies","2,118",4.5,18.99,https://www.amazon.com/Multi-vitamin-Gummies-Vegetarian-gelatin-Vitamins/dp/B01F44QH62/ref=sr_1_254?keywords=multivitamin+for+kids&qid=1660952918&sr=8-254
314,"Multivitamin Gummies for Adults Men Woman & Teens, Formulated with 14 Essential Vitamins & Minerals, Gluten & Gelatin Free, Vegetarian, Pectin Chewable Gummy Chews, Berry Flavor [Packaging May Vary]",100,3.8,10.95,https://www.amazon.com/Multivitamin-Formulated-Essential-Vitamins-Vegetarian/dp/B09NCF1P2V/ref=sr_1_255?keywords=multivitamin+for+kids&qid=1660952918&sr=8-255
315,"ChildLife Essentials Immune Support 4-Pack for Infants, Babies, Kids, and Toddlers - Vitamin D3 Natural Berry Drops, Liquid Vitamin C Natural Orange, Echinacea Natural Orange, and First Defense",129,4.8,29.99,https://www.amazon.com/ChildLife-Essentials-Support-Infants-Toddlers/dp/B08SSZVK6S/ref=sr_1_256?keywords=multivitamin+for+kids&qid=1660952918&sr=8-256
316,"Flintstones Chewable Kids Vitamins, Complete Multivitamin for Kids and Toddlers with Iron, Calcium, Vitamin C, Vitamin D & more, 180ct","14,079",4.6,16.79,https://www.amazon.com/gp/slredirect/picassoRedirect.html/ref=pa_sp_mtf_aps_sr_pg6_1?ie=UTF8&adId=A00861213HIWZUWPAC5M9&url=%2FFlintstones-Vitamins-Childrens-Multivitamin-Supplement%2Fdp%2FB0771WL4SD%2Fref%3Dsr_1_257_sspa%3Fkeywords%3Dmultivitamin%2Bfor%2Bkids%26qid%3D1660952918%26rdc%3D1%26sr%3D8-257-spons%26psc%3D1&qualifier=1660952918&id=958870467690463&widgetName=sp_mtf
317,"SmartyPants Teen Guy Formula, Daily Multivitamin Gummies: Vitamins C, B12, K, Zinc, & Biotin for Immune Support, Energy, Skin & Hair Support, Assorted Fruit Flavor, 120 Gummies (30 Day Supply)","11,302",4.5,16.37,https://www.amazon.com/gp/slredirect/picassoRedirect.html/ref=pa_sp_mtf_aps_sr_pg6_1?ie=UTF8&adId=A0161561UVUQ4JE7AWYY&url=%2FSmartyPants-Complete-Daily-Gummy-Vitamins%2Fdp%2FB0741FTPXD%2Fref%3Dsr_1_258_sspa%3Fkeywords%3Dmultivitamin%2Bfor%2Bkids%26qid%3D1660952918%26sr%3D8-258-spons%26psc%3D1&qualifier=1660952918&id=958870467690463&widgetName=sp_mtf
318,"Kids Vitamins. Unflavored & Tasteless Liquid Kids Multivitamin. Sugar Free 14-in-1 Vegan Supplement Drops for Kids, Children, Teens. Mix in Juice, Milk, Or Water and Your Kids Won't Even Taste It!",6,3.5,15.95,https://www.amazon.com/gp/slredirect/picassoRedirect.html/ref=pa_sp_mtf_aps_sr_pg6_1?ie=UTF8&adId=A00712147ULTKR3WFA5D&url=%2FVitamins-Unflavored-Tasteless-Multivitamin-Supplement%2Fdp%2FB0B15PCP4W%2Fref%3Dsr_1_259_sspa%3Fkeywords%3Dmultivitamin%2Bfor%2Bkids%26qid%3D1660952918%26sr%3D8-259-spons%26psc%3D1&qualifier=1660952918&id=958870467690463&widgetName=sp_mtf
319,"Flintstones SuperBeans, Kids Multivitamin with Immunity Support with Vitamins A, D, Iodine & Zinc to Support Healthy Growth, Fruit Flavored, Vegetarian, Jelly Bean Chews, 90 Count (Packaging may vary)","1,338",4.6,9.97,https://www.amazon.com/gp/slredirect/picassoRedirect.html/ref=pa_sp_mtf_aps_sr_pg6_1?ie=UTF8&adId=A0712964AETOE1VY43XW&url=%2FFlintstones-SuperBeans-Multivitamin-Vitamins-Development%2Fdp%2FB08X8FSL6C%2Fref%3Dsr_1_260_sspa%3Fkeywords%3Dmultivitamin%2Bfor%2Bkids%26qid%3D1660952918%26rdc%3D1%26sr%3D8-260-spons%26psc%3D1&qualifier=1660952918&id=958870467690463&widgetName=sp_mtf
320,"SUPPZAAR Kids Vitamins | 45-90 Day Kids Multivitamin Gummies | Gummy Vitamins with Vegetarian, Non-GMO & Gluten Free Ingredients | Multivitamin for Kids | Vitamins for Kids | Toddler Vitamins | 90 Ct",30,4.4,11.99,https://www.amazon.com/SUPPZAAR-Kids-Multivitamin-Gummies-Vegetarian/dp/B09KMCZPMH/ref=sr_1_261?keywords=multivitamin+for+kids&qid=1660952918&sr=8-261
321,Calcium with Vitamin D3 & Vitamin K2 | 2 Month Supply | Calcium Supplement | Bone Support | Calcium with Vitamin D3 K2 Gummies | Vegan | Non-GMO | Gluten Free | 60 Count,"2,988",4.7,29.95,https://www.amazon.com/Organic-Vitamin-Calcium-MaryRuth-Chewable/dp/B07GC86WMY/ref=sr_1_262?keywords=multivitamin+for+kids&qid=1660952918&sr=8-262
322,"NaturesPlus Animal Parade Source of Life Tooth Fairy Children's Chewable - Natural Vanilla Flavor - 90 Animal Shaped Tablets - Dental Health Supplement - Vegetarian, Gluten-Free - 45 Servings",337,4.6,25.82,https://www.amazon.com/Natures-Plus-Animal-Childrens-Chewable/dp/B00FZN83PQ/ref=sr_1_263?keywords=multivitamin+for+kids&qid=1660952918&sr=8-263
323,"KIDS VITAMINS | Ruwaa Nutrition USDA Organic Kids Multivitamin Gummies | Vitamins For Kids, Zinc, Vitamin C, D, E, B6, Growth And Immune Support For Kids | Kids Chewable Vitamins, Gluten-Free, Non-GMO",31,4.2,19.97,https://www.amazon.com/Multivitamin-Vitamins-Multivitamins-Childrens-Chewable/dp/B08Y5JR5X1/ref=sr_1_264?keywords=multivitamin+for+kids&qid=1660952918&sr=8-264
324,"USDA Organic Kids Vitamin Gummies (Non-GMO) Yummy Natural Fruit Flavors - Complete Kids Multivitamin Gummies: Vitamin C, D, B, A, Zinc - Supplement for Energy, Mood, Immune Support - 60 Gummy Vitamins",67,4.5,14.97,https://www.amazon.com/Organic-Vitamin-Gummies-Non-GMO-Natural/dp/B097P11V4J/ref=sr_1_265?keywords=multivitamin+for+kids&qid=1660952918&sr=8-265
325,"Iron Gummies for Kids – Non-GMO Kids Vitamins with Iron - Gluten-Free Kids Gummy Vitamins - Chewable Kids Iron Supplement with Vitamin A, B3, B5, B6, B12, and Zinc for Kids Nutrition, 1Pack, 100 Count",603,4.2,16.99,https://www.amazon.com/Iron-Gummies-Kids-Gluten-Free-Supplement/dp/B08MV82VB6/ref=sr_1_266?keywords=multivitamin+for+kids&qid=1660952918&sr=8-266
326,"Zarbee's Kids 1mg Melatonin Chewable Tablet, Drug-Free & Effective Sleep Supplement, Easy to Take Natural Grape Flavor Tablets for Children Ages 3 and Up, 30 Count","60,876",4.7,7.98,https://www.amazon.com/Zarbees-Naturals-Childrens-Chewable-Melatonin/dp/B00C2WEJT2/ref=sr_1_267?keywords=multivitamin+for+kids&qid=1660952918&rdc=1&sr=8-267
327,Zinc Supplements for Immune Support | Liquid Zinc Supplement | Ionic Zinc for Kids | Ages 4-13 | Zinc Sulfate | Skin Care Supplement | Vegan | Non-GMO | Gluten Free | 2 Fl Oz,308,4.7,17.85,https://www.amazon.com/Supplements-Support-Supplement-Sulfate-Non-GMO/dp/B08TBYT65L/ref=sr_1_268?keywords=multivitamin+for+kids&qid=1660952918&sr=8-268
328,Tropical Oasis MultiVitamin Mineral/ for CHILDREN (16 oz) Liquid,68,4.5,13.95,https://www.amazon.com/Tropical-Oasis-MultiVitamin-Mineral-CHILDREN/dp/B000JZSHV0/ref=sr_1_269?keywords=multivitamin+for+kids&qid=1660952918&sr=8-269
329,EMS Kirkland Signature Children's Complete Multivitamin Gummies 320 Count,61,4.3,22.55,https://www.amazon.com/Kirkland-Signature-Childrens-Complete-Multivitamin/dp/B0943F6MR2/ref=sr_1_270?keywords=multivitamin+for+kids&qid=1660952918&sr=8-270
330,"Nature's Bounty Kid's Multivitamin Jelly Beans, 1 ea",1,5.0,none,https://www.amazon.com/Natures-Bounty-Multivitamin-Jelly-Beans/dp/B09L8LQ28H/ref=sr_1_271?keywords=multivitamin+for+kids&qid=1660952918&sr=8-271
331,"Kid Natural - Healthy 'N Fit Chewable Multivitamin -60 count, Natural Fruit Flavored Chewables: Children’s Total Nutrient Complex, Supporting A Growing Body and Mind",15,3.9,17.29,https://www.amazon.com/Healthy-Fit-Natural-Chewable-Vitamins/dp/B00Q6V677W/ref=sr_1_272?keywords=multivitamin+for+kids&qid=1660952918&sr=8-272
332,"L'il Critters Kids Calcium Gummy Bears with Vitamin D3 , 150ct","6,516",4.7,12.77,https://www.amazon.com/gp/slredirect/picassoRedirect.html/ref=pa_sp_mtf_aps_sr_pg6_1?ie=UTF8&adId=A10019561J69DCEIDAG5X&url=%2FLil-Critters-Calcium-Vitamin-Supplement%2Fdp%2FB00421MNIU%2Fref%3Dsr_1_273_sspa%3Fkeywords%3Dmultivitamin%2Bfor%2Bkids%26qid%3D1660952918%26sr%3D8-273-spons%26psc%3D1&qualifier=1660952918&id=958870467690463&widgetName=sp_mtf
333,"Whole Fruit Gummy Vitamins for Kids No Added Sugar, Vegan Kids Multivitamin Gummies, Plant Based Multivitamin for Kids, Whole Foods Toddler Vitamins, Organic Kids Vitamins Chewable 60 Bites Strawberry","1,772",4.3,25.95,https://www.amazon.com/gp/slredirect/picassoRedirect.html/ref=pa_sp_mtf_aps_sr_pg6_1?ie=UTF8&adId=A0190492YIWV2GJWIOY7&url=%2FMultivitamin-Organic-Plant-Based-Vitamins-Strawberry%2Fdp%2FB07PB657SW%2Fref%3Dsr_1_274_sspa%3Fkeywords%3Dmultivitamin%2Bfor%2Bkids%26qid%3D1660952918%26sr%3D8-274-spons%26psc%3D1%26smid%3DA14M046EBK0J2H&qualifier=1660952918&id=958870467690463&widgetName=sp_mtf
334,"Culturelle Kids Complete Multivitamin + Probiotic Chewable, Digestive & Immune Support for Kids, With 11 Vitamins & Minerals including Vitamin C, D3 and Zinc, Fruit Punch Flavor, 50 Count","3,758",4.8,15.73,https://www.amazon.com/gp/slredirect/picassoRedirect.html/ref=pa_sp_mtf_aps_sr_pg6_1?ie=UTF8&adId=A0972207106YAUKVOJUGS&url=%2FCulturelle-Multivitamin-Probiotic-Supplement-probiotic%25E2%258C%2598%2Fdp%2FB07N7ZM39Z%2Fref%3Dice_ac_b_dpb_sspa%3Fkeywords%3Dmultivitamin%2Bfor%2Bkids%26qid%3D1660952918%26sr%3D8-275-spons%26psc%3D1&qualifier=1660952918&id=958870467690463&widgetName=sp_mtf
335,"Celltrient Energy Drink Mix, Summer Cherry, 14 Count",71,4.0,34.99,https://www.amazon.com/gp/slredirect/picassoRedirect.html/ref=pa_sp_mtf_aps_sr_pg6_1?ie=UTF8&adId=A0402801218GQR97QXQG1&url=%2FCelltrient-Energy-Drink-Summer-Cherry%2Fdp%2FB08CHXT2Y5%2Fref%3Dsr_1_276_sspa%3Fkeywords%3Dmultivitamin%2Bfor%2Bkids%26qid%3D1660952918%26sr%3D8-276-spons%26psc%3D1&qualifier=1660952918&id=958870467690463&widgetName=sp_mtf
336,"Flintstones Sour Gummies Kids Vitamins, Gummy Multivitamin for Kids with Vitamins A, B6, B12, C, D & more, 180ct","1,105",4.8,13.92,https://www.amazon.com/Flintstones-Childrens-Complete-Multivitamin-Gummies/dp/B00BV47LTM/ref=sr_1_277?keywords=multivitamin+for+kids&qid=1660952918&rdc=1&sr=8-277
337,"Vitamin Friends - Iron Supplements for Kids (2 Pack) B-Complex, Vitamin C, Zinc, Biotin - Iron Gummies Support Healthy Body Function Iron Levels - Vegan, Allergen Free…",144,4.4,37.95,https://www.amazon.com/Vitamin-Friends-Kids-Iron-Gummies/dp/B079597F8Q/ref=sr_1_278?keywords=multivitamin+for+kids&qid=1660952918&sr=8-278
338,"Dr. Wholeness Head Start Multivitamin Powder | Essential Nutrients for Growing Children, Methylated B-Vitamins, Easy to Mix, No Flavors, Sweeteners Or Preservatives - 60 Servings",25,3.8,32.95,https://www.amazon.com/Dr-Wholeness-Multivitamin-Methylated-Preservatives/dp/B092PM1KLF/ref=sr_1_279?keywords=multivitamin+for+kids&qid=1660952918&sr=8-279
339,"PreSteps Daily - Liquid Multivitamin for Kids & Infants - Toddler Multivitamins with Vitamin A, B Complex, C, and E - Natural Orange Flavor - Sugar Free - 2 Month Supply - 60ml - CaliVita",3,4.2,11.99,https://www.amazon.com/PreSteps-Daily-Multivitamin-Multivitamins-CaliVita/dp/B084Q6DN7X/ref=sr_1_280?keywords=multivitamin+for+kids&qid=1660952918&sr=8-280
340,USDA Organic Vitamin D3 Liquid Drops for Kids by MaryRuth's | 640 IU Vitamin D3 Per Serving | Kids Immune Support & Bone Health Supplement | Formulated for Ages 4-13 | 0.5oz,232,4.6,19.99,https://www.amazon.com/Mary-Ruths-Kids-Vitamin-Drops/dp/B08TC5GB4W/ref=sr_1_281?keywords=multivitamin+for+kids&qid=1660952918&sr=8-281
341,Lil Critters Kids Probiotics Gummies 60 Count,"2,386",4.7,11.99,https://www.amazon.com/Lil-Critters-Probiotic-60-Count/dp/B0009DVYVC/ref=sr_1_282?keywords=multivitamin+for+kids&qid=1660952918&sr=8-282
342,"NaturesPlus Animal Parade Source of Life Children's Chewable Multivitamin - Orange Flavor - 180 Animal Shaped Tablets - Promotes Health & Wellbeing - Gluten-Free, Vegetarian - 90 Servings",123,4.7,24.35,https://www.amazon.com/Natures-Plus-Childrens-Chewable-Multivitamin/dp/B0019LRN4A/ref=sr_1_283?keywords=multivitamin+for+kids&qid=1660952918&sr=8-283
343,"[120 Count] 8 in 1 Immune Heath Support Multivitamin Gummies & Probiotics Formulated for Kids - Vitamin C, D3, B12, B6, Zinc, Elderberry, Selenium - Dietary Supplement, Berry Flavored Chewable Gummy",34,4.6,13.95,https://www.amazon.com/Support-Multivitamin-Gummies-Probiotics-Formulated/dp/B08WLGYP4S/ref=sr_1_284?keywords=multivitamin+for+kids&qid=1660952918&sr=8-284
344,"Life Extension Children's Formula Life Extension Mix Berry-Flavored, Kid-Friendly Chewable Multivitamin – Gluten-Free, Non-GMO – 120 Chewable Tablets",88,4.4,18.75,https://www.amazon.com/Life-Extension-Childrens-Formula-Chewable/dp/B0758J9B75/ref=sr_1_285?keywords=multivitamin+for+kids&qid=1660952918&sr=8-285
345,"Bluebonnet Nutrition Rainforest Animalz Whole Food Based Multiple Chewable Tablets, Kids Multivitamin & Mineral, Vitamin C, D3, Iron, Gluten Free, Milk Free, Kosher, 180 Chewable Tablets, Grape Flavor",121,4.6,28.76,https://www.amazon.com/Bluebonnet-Nutrition-Rainforest-Multiple-Multivitamin/dp/B0064OA092/ref=sr_1_286?keywords=multivitamin+for+kids&qid=1660952918&sr=8-286
346,"Pure Encapsulations O.N.E. Multivitamin | Once Daily Multivitamin with Antioxidant Complex Metafolin, CoQ10, and Lutein to Support Vision, Cognitive Function, and Cellular Health* | 120 Capsules","6,326",4.7,77.25,https://www.amazon.com/Pure-Encapsulations-N-Multivitamin-Hypoallergenic/dp/B01BGZVXC6/ref=sr_1_287?keywords=multivitamin+for+kids&qid=1660952918&sr=8-287
347,"Jamieson Multivitamin for Kids, 60 chewable tabs",1,5.0,29.99,https://www.amazon.com/Jamieson-Multivitamin-Kids-chewable-tabs/dp/B01K482FM8/ref=sr_1_288?keywords=multivitamin+for+kids&qid=1660952918&sr=8-288
